{
  "$schema": "https://json-schema.org/draft/2020-12/schema",
  "$id": "usage-event.schema.json",
  "title": "UsageEvent",
  "type": "object",
  "additionalProperties": false,
  "required": [
    "event_id",
    "timestamp_ms",
    "app_id",
    "request_id",
    "routing_decision_id",
    "endpoint_id",
    "provider_kind",
    "tokens_in",
    "tokens_out",
    "latency_ms"
  ],
  "properties": {
    "event_id": { "type": "string" },
    "timestamp_ms": { "type": "integer", "minimum": 0 },
    "app_id": { "type": "string" },
    "org_id": { "type": "string" },
    "request_id": { "type": "string" },
    "routing_decision_id": { "type": "string" },
    "endpoint_id": { "type": "string" },
    "model_id": { "type": "string" },
    "reasoning_effort": { "type": ["string", "null"], "minLength": 1, "maxLength": 128 },
    "effort_source": {
      "type": "string",
      "enum": ["named", "disabled", "provider_default", "none", "client", "variant", "variant_coerced"]
    },
    "package_id": { "type": "string" },
    "provider_kind": { "type": "string" },
    "tokens_in": { "type": "integer", "minimum": 0 },
    "tokens_in_source": {
      "type": "string",
      "enum": ["measured", "normalized", "estimated", "unavailable"]
    },
    "tokens_in_available": { "type": "boolean" },
    "tokens_out": { "type": "integer", "minimum": 0 },
    "tokens_out_source": {
      "type": "string",
      "enum": ["measured", "normalized", "estimated", "unavailable"]
    },
    "tokens_out_available": { "type": "boolean" },
    "latency_ms": { "type": "number", "minimum": 0 },
    "cost_actual": { "type": "number", "minimum": 0 },
    "cost_estimate": { "type": "number", "minimum": 0 },
    "currency": { "type": "string" },
    "error_class": { "type": "string" },
    "sample_source": { "type": "string", "enum": ["live_request", "benchmark"] }
  }
}
