{
  "event_id": "usage-001",
  "timestamp_ms": 1712880000000,
  "app_id": "gateway-smoke",
  "org_id": "local-dev",
  "request_id": "request-001",
  "routing_decision_id": "decision-001",
  "endpoint_id": "cli.local.coder",
  "model_id": "gpt-5.4",
  "package_id": "role-model-router/provider-cli",
  "provider_kind": "cli",
  "tokens_in": 48,
  "tokens_in_source": "measured",
  "tokens_in_available": true,
  "tokens_out": 24,
  "tokens_out_source": "measured",
  "tokens_out_available": true,
  "latency_ms": 180,
  "cost_actual": 0.0008,
  "cost_estimate": 0.001,
  "currency": "USD",
  "error_class": "none",
  "sample_source": "live_request"
}
